{
  "$schema": "../schemas/dungeon_level.schema.json",
  "level_id": "f47ac10b-58cc-4372-a567-0e02b2c3d479",
  "depth": 1,
  "theme": "goblin_warrens",
  "name": "The Fungal Pantry of Gribbles Rindsworth",
  "flavor_text": "The air grows thick with the pungent aroma of cave mushrooms and... is that cheese? The rough-hewn tunnels ahead are goblin-made, their walls scratched with crude drawings of what appears to be a very small figure wearing an oversized crown and holding a wedge of cheese aloft like a holy relic. Welcome to the domain of Gribbles Rindsworth the Magnificent.",
  "created_at": "2025-01-15T00:00:00Z",
  "is_persistent": true,
  "hex_map": {
    "map_id": "a1b2c3d4-e5f6-7890-abcd-ef1234567890",
    "name": "Goblin Warrens - Level 1",
    "hex_size_ft": 5,
    "orientation": "flat-top",
    "dimensions": {
      "min_q": -6,
      "max_q": 6,
      "min_r": -6,
      "max_r": 6
    },
    "hexes": [
      {
        "q": 0,
        "r": 0,
        "terrain": "stone_floor",
        "room_id": "room-entrance-001",
        "is_passable": true,
        "elevation_ft": 0
      },
      {
        "q": 1,
        "r": 0,
        "terrain": "stone_floor",
        "room_id": "room-entrance-001",
        "is_passable": true,
        "elevation_ft": 0
      },
      {
        "q": 0,
        "r": 1,
        "terrain": "stone_floor",
        "room_id": "room-entrance-001",
        "is_passable": true,
        "elevation_ft": 0
      },
      {
        "q": 1,
        "r": 1,
        "terrain": "stone_floor",
        "room_id": "room-entrance-001",
        "is_passable": true,
        "elevation_ft": 0
      },
      {
        "q": -1,
        "r": 0,
        "terrain": "stone_floor",
        "room_id": "room-entrance-001",
        "is_passable": true,
        "elevation_ft": 0
      },
      {
        "q": 2,
        "r": -1,
        "terrain": "stone_floor",
        "room_id": null,
        "is_passable": true,
        "elevation_ft": 0
      },
      {
        "q": 3,
        "r": -1,
        "terrain": "stone_floor",
        "room_id": null,
        "is_passable": true,
        "elevation_ft": 0
      },
      {
        "q": 3,
        "r": -2,
        "terrain": "stone_floor",
        "room_id": null,
        "is_passable": true,
        "elevation_ft": 0
      },
      {
        "q": 4,
        "r": -2,
        "terrain": "mud",
        "room_id": "room-pantry-002",
        "is_passable": true,
        "elevation_ft": 0
      },
      {
        "q": 4,
        "r": -3,
        "terrain": "fungal_growth",
        "room_id": "room-pantry-002",
        "is_passable": true,
        "elevation_ft": 0
      },
      {
        "q": 5,
        "r": -3,
        "terrain": "fungal_growth",
        "room_id": "room-pantry-002",
        "is_passable": true,
        "elevation_ft": 0
      },
      {
        "q": 5,
        "r": -4,
        "terrain": "mud",
        "room_id": "room-pantry-002",
        "is_passable": true,
        "elevation_ft": 0
      },
      {
        "q": 4,
        "r": -4,
        "terrain": "fungal_growth",
        "room_id": "room-pantry-002",
        "is_passable": true,
        "elevation_ft": 0
      },
      {
        "q": 3,
        "r": -3,
        "terrain": "mud",
        "room_id": "room-pantry-002",
        "is_passable": true,
        "elevation_ft": 0
      },
      {
        "q": -1,
        "r": 2,
        "terrain": "stone_floor",
        "room_id": null,
        "is_passable": true,
        "elevation_ft": -5
      },
      {
        "q": -1,
        "r": 3,
        "terrain": "stone_floor",
        "room_id": null,
        "is_passable": true,
        "elevation_ft": -5
      },
      {
        "q": -2,
        "r": 3,
        "terrain": "rubble",
        "room_id": "room-spiders-003",
        "is_passable": true,
        "elevation_ft": -5
      },
      {
        "q": -2,
        "r": 4,
        "terrain": "webbing",
        "room_id": "room-spiders-003",
        "is_passable": true,
        "elevation_ft": -5
      },
      {
        "q": -3,
        "r": 4,
        "terrain": "webbing",
        "room_id": "room-spiders-003",
        "is_passable": true,
        "elevation_ft": -5
      },
      {
        "q": -3,
        "r": 5,
        "terrain": "webbing",
        "room_id": "room-spiders-003",
        "is_passable": true,
        "elevation_ft": -5
      },
      {
        "q": -1,
        "r": 4,
        "terrain": "rubble",
        "room_id": "room-spiders-003",
        "is_passable": true,
        "elevation_ft": -5
      },
      {
        "q": 0,
        "r": -2,
        "terrain": "stone_floor",
        "room_id": null,
        "is_passable": true,
        "elevation_ft": 0
      },
      {
        "q": 0,
        "r": -3,
        "terrain": "stone_floor",
        "room_id": null,
        "is_passable": true,
        "elevation_ft": 0
      },
      {
        "q": -1,
        "r": -3,
        "terrain": "stone_carved",
        "room_id": "room-throne-004",
        "is_passable": true,
        "elevation_ft": 5
      },
      {
        "q": -1,
        "r": -4,
        "terrain": "stone_carved",
        "room_id": "room-throne-004",
        "is_passable": true,
        "elevation_ft": 5
      },
      {
        "q": 0,
        "r": -4,
        "terrain": "stone_carved",
        "room_id": "room-throne-004",
        "is_passable": true,
        "elevation_ft": 5
      },
      {
        "q": 0,
        "r": -5,
        "terrain": "stone_carved",
        "room_id": "room-throne-004",
        "is_passable": true,
        "elevation_ft": 5
      },
      {
        "q": -2,
        "r": -3,
        "terrain": "stone_carved",
        "room_id": "room-throne-004",
        "is_passable": true,
        "elevation_ft": 5
      },
      {
        "q": -2,
        "r": -4,
        "terrain": "stone_carved",
        "room_id": "room-throne-004",
        "is_passable": true,
        "elevation_ft": 5
      },
      {
        "q": 1,
        "r": -4,
        "terrain": "stone_carved",
        "room_id": "room-throne-004",
        "is_passable": true,
        "elevation_ft": 5
      },
      {
        "q": 3,
        "r": 1,
        "terrain": "stone_floor",
        "room_id": null,
        "is_passable": true,
        "elevation_ft": 0
      },
      {
        "q": 4,
        "r": 0,
        "terrain": "stone_floor",
        "room_id": null,
        "is_passable": true,
        "elevation_ft": 0
      },
      {
        "q": 5,
        "r": 0,
        "terrain": "stone_floor",
        "room_id": "room-rest-005",
        "is_passable": true,
        "elevation_ft": 0
      },
      {
        "q": 5,
        "r": 1,
        "terrain": "stone_floor",
        "room_id": "room-rest-005",
        "is_passable": true,
        "elevation_ft": 0
      },
      {
        "q": 6,
        "r": 0,
        "terrain": "stone_floor",
        "room_id": "room-rest-005",
        "is_passable": true,
        "elevation_ft": 0
      },
      {
        "q": 6,
        "r": -1,
        "terrain": "stone_floor",
        "room_id": "room-rest-005",
        "is_passable": true,
        "elevation_ft": 0
      }
    ],
    "connections": [
      {
        "connection_id": "conn-001",
        "from": {
          "q": 1,
          "r": 0
        },
        "to": {
          "q": 2,
          "r": -1
        },
        "type": "open_passage",
        "is_known": true
      },
      {
        "connection_id": "conn-002",
        "from": {
          "q": 3,
          "r": -2
        },
        "to": {
          "q": 4,
          "r": -2
        },
        "type": "door",
        "is_known": true,
        "is_locked": false,
        "description": "A crude wooden door with 'KEEPE OUT \u2014 GRIBBLES PANTREE' scratched into it"
      },
      {
        "connection_id": "conn-003",
        "from": {
          "q": 0,
          "r": 1
        },
        "to": {
          "q": -1,
          "r": 2
        },
        "type": "stairs",
        "is_known": true,
        "description": "Rough-cut stairs descending into darkness. Spider silk glistens on the walls."
      },
      {
        "connection_id": "conn-004",
        "from": {
          "q": -1,
          "r": 0
        },
        "to": {
          "q": 0,
          "r": -2
        },
        "type": "open_passage",
        "is_known": true
      },
      {
        "connection_id": "conn-005",
        "from": {
          "q": 0,
          "r": -3
        },
        "to": {
          "q": -1,
          "r": -3
        },
        "type": "door",
        "is_known": true,
        "is_locked": true,
        "lock_dc": 20,
        "description": "A surprisingly well-crafted iron-banded door with a sign reading 'HIS MOST MAGNIFICENTEST MAJESTY'S THRONE ROOM \u2014 KNOCK FIRST'"
      },
      {
        "connection_id": "conn-006",
        "from": {
          "q": 1,
          "r": 0
        },
        "to": {
          "q": 3,
          "r": 1
        },
        "type": "secret_door",
        "is_known": false,
        "perception_dc": 22,
        "description": "A section of wall that swings open when a loose stone shaped like a cheese wedge is pressed."
      },
      {
        "connection_id": "conn-007",
        "from": {
          "q": 4,
          "r": 0
        },
        "to": {
          "q": 5,
          "r": 0
        },
        "type": "open_passage",
        "is_known": false
      }
    ],
    "regions": [
      {
        "region_id": "region-entrance",
        "name": "The Welcoming Gutter",
        "hexes": [
          {
            "q": 0,
            "r": 0
          },
          {
            "q": 1,
            "r": 0
          },
          {
            "q": 0,
            "r": 1
          },
          {
            "q": 1,
            "r": 1
          },
          {
            "q": -1,
            "r": 0
          }
        ],
        "environmental_effects": [],
        "lighting": "dim"
      },
      {